JOB Title,Link,Price
"do Web Scraping, Data Mining and web crawling of Any website",https://www.peopleperhour.com/hourlie/do-web-scraping-data-mining-and-web-crawling-of-any-website/189758,$40
web scraping / crawling / Harvest/ data scraping from any website or directory,https://www.peopleperhour.com/hourlie/web-scraping-crawling-harvest-data-scraping-from-any-website-or-directory/23952,$40
web Scraping/Data Mining/Data Extraction,https://www.peopleperhour.com/hourlie/web-scraping-data-mining-data-extraction/46377,$40
do web scraping/crawling of any website you provide,https://www.peopleperhour.com/hourlie/do-web-scraping-crawling-of-any-website-you-provide/257874,$40
scrape upto 10000 records from any directory,https://www.peopleperhour.com/hourlie/scrape-upto-10000-records-from-any-directory/97712,$40
provide 2 hours of VA and Data Entry services,https://www.peopleperhour.com/hourlie/provide-2-hours-of-va-and-data-entry-services/107292,$40
provide Business Emails list and Leads for Marketing Purpose,https://www.peopleperhour.com/hourlie/provide-business-emails-list-and-leads-for-marketing-purpose/255922,$40
data scrapping research for 500 Email address.,https://www.peopleperhour.com/hourlie/data-scrapping-research-for-500-email-address/321516,$40
"web Scraping, Data Extracting from any website - CHEAP n FAST",https://www.peopleperhour.com/hourlie/web-scraping-data-extracting-from-any-website-cheap-n-fast/534863,$40
"b2B Lead Generation, Data Scraping from website for any industry",https://www.peopleperhour.com/hourlie/b2b-lead-generation-data-scraping-from-website-for-any-industry/914834,$40
"web Scraping, Data Scraping, Mining, Crawling Of Any Website",https://www.peopleperhour.com/hourlie/web-scraping-data-scraping-mining-crawling-of-any-website/787001,$40
"web Scraping, Web Extracting - CHEAP, QUICK and RELIABLE",https://www.peopleperhour.com/hourlie/web-scraping-web-extracting-cheap-quick-and-reliable/751976,$40
